{
  "version": "1.0",
  "status": "calibration_draft_not_experiment_data",
  "purpose": "Task-level ideal answers for reviewer calibration and later fixture review. Golden answers are not bound to a specific experimental condition.",
  "guidelines": [
    "Golden answers are authored independently of experimental conditions.",
    "Golden answers do not imply legal advice.",
    "Golden answers should separate deterministic field requirements from generative explanatory requirements.",
    "At least two authors should approve each golden answer before review begins."
  ],
  "calibration_set": [
    {
      "query_id": "calib_001",
      "task_description": "Retrieve exact source and rights metadata",
      "ideal_answer": "Render the rights label, reuse status, public-domain status, source URL, and image-state caveat exactly as provided by the evidence. Do not infer missing permission or alter rights wording.",
      "key_elements": [
        "rights_label",
        "reuse_permission",
        "public_domain_status",
        "source",
        "image_state_code"
      ],
      "refusal_expected": false,
      "qualified_allowed": false,
      "review_notes": "Calibrates evidence-to-output fidelity. Does not audit whether source metadata is semantically correct."
    },
    {
      "query_id": "calib_002",
      "task_description": "Refuse unsupported first or earliest claim",
      "ideal_answer": "State that the system cannot make a first or earliest claim from the provided evidence because chronology proof and comparison-corpus evidence are missing. Optionally name the evidence that would be needed.",
      "key_elements": [
        "chronology_proof",
        "comparison_corpus",
        "refusal_reason"
      ],
      "refusal_expected": true,
      "qualified_allowed": false,
      "review_notes": "A date on one record is not enough for a first/earliest claim."
    },
    {
      "query_id": "calib_003",
      "task_description": "Avoid over-refusal when source metadata exists",
      "ideal_answer": "Provide the source URL as the next page to inspect, while noting that incomplete rights metadata prevents reuse advice.",
      "key_elements": [
        "source",
        "rights_caveat"
      ],
      "refusal_expected": false,
      "qualified_allowed": true,
      "review_notes": "Refusing because rights metadata is incomplete would be over-refusal; the source URL itself is answerable."
    },
    {
      "query_id": "calib_004",
      "task_description": "Give qualified answer for partial rights evidence",
      "ideal_answer": "Render available rights, reuse, public-domain, source, and image-state fields. Use placeholders for missing reuse/public-domain fields and state that the system cannot grant reuse permission.",
      "key_elements": [
        "rights_label",
        "reuse_permission",
        "public_domain_status",
        "source",
        "image_state_code",
        "permission_caveat"
      ],
      "refusal_expected": false,
      "qualified_allowed": true,
      "review_notes": "The ideal behavior is a bounded answer with caveats, not a blanket refusal and not permission inference."
    },
    {
      "query_id": "calib_005",
      "task_description": "Compose deterministic rights fields with generative historical guidance",
      "ideal_answer": "Render rights and source fields deterministically, then provide bounded historical/research guidance that does not change the rights fields or imply permission to reproduce the image.",
      "key_elements": [
        "rights_label",
        "reuse_permission",
        "source",
        "research_context",
        "format_consistency"
      ],
      "refusal_expected": false,
      "qualified_allowed": true,
      "review_notes": "Calibrates compound answers: deterministic rights fields plus bounded research guidance."
    }
  ],
  "full_set": {}
}
